{
  "id": "american-express-1994-1995",
  "company_id": "american-express",
  "title": "美国运通：1994-1995 的普通股扩仓与长期持有案例",
  "status": "active",
  "case_type": "compounder",
  "buy_window": {
    "start_year": 1994,
    "end_year": 1995,
    "completed_label": "purchases essentially completed in 1995"
  },
  "summary": {
    "one_liner": "虽然美国运通最著名的第一次危机买入在 1964 年，但本地语料能完整支持的是 1994-1995 这轮大规模普通股持仓与其后长期持有逻辑。",
    "cost_basis_total_usd_m": 1300,
    "current_state": "still holding"
  },
  "market_context": [
    {
      "year": 1994,
      "summary": "巴菲特把这次加大持仓描述为增加对熟悉且喜欢的业务的经济权益，而不是短期行情交易。"
    }
  ],
  "valuation_checkpoints": [
    {
      "year": 1994,
      "label": "reloaded common stock position",
      "shares": 27759941,
      "cost_usd_m": 723.919,
      "market_value_usd_m": 818.918
    },
    {
      "year": 1995,
      "label": "purchases essentially completed",
      "shares": 49456900,
      "cost_usd_m": 1392.7,
      "market_value_usd_m": 2046.3
    },
    {
      "year": 2022,
      "label": "long-duration result",
      "cost_usd_m": 1300,
      "market_value_usd_m": 22000,
      "dividend_usd_m": 302
    }
  ],
  "thesis": [
    "美国运通是全球金融信用品牌，需求具有长期性。",
    "巴菲特愿意增加自己熟悉且喜欢的业务的经济权益。",
    "股票回购会在不追加成本的情况下提高伯克希尔的持股占比。"
  ],
  "hold_logic": [
    "2023 年巴菲特再次把 AmEx 与 Coke 并列为应长期持有的优秀企业。",
    "2022 年股东信明确回顾：持仓基本在 1995 年完成，总成本约 13 亿美元。",
    "2023 年他写到当年没有买也没有卖一股。"
  ],
  "exit_logic": {
    "type": "not-sold",
    "summary": "当前更适合写长期持有逻辑，而不是卖出逻辑。"
  },
  "known_gaps": [
    "1964 年 salad oil scandal 的首次危机买入不在本地原始语料覆盖范围内。",
    "如果要做完整 AmEx 案例，应该拆成 1964 危机买入、1991 PERCs、1994-1995 普通股扩仓三个 case。"
  ],
  "citations": [
    {
      "year": 1994,
      "page": 13,
      "tag": "buy",
      "claim": "1994 年已显著扩大普通股仓位。",
      "excerpt": "27,759,941 American Express Company ... $723,919 $818,918"
    },
    {
      "year": 1994,
      "page": 14,
      "tag": "context",
      "claim": "巴菲特主动把 AmEx 归入自己长期熟悉的业务集合。",
      "excerpt": "an investor frequently gets the chance to increase his economic interest in businesses he knows and likes"
    },
    {
      "year": 1995,
      "page": 12,
      "tag": "buy",
      "claim": "到 1995 年，仓位和成本已接近后续回顾中的最终形态。",
      "excerpt": "49,456,900 American Express Company ... $1,392.7 $2,046.3"
    },
    {
      "year": 2022,
      "page": 4,
      "tag": "valuation",
      "claim": "2022 年直接回顾了 1995 年完成建仓、13 亿成本、302 百万美元股息。",
      "excerpt": "Berkshire’s purchases of Amex were essentially completed in 1995 and, coincidentally, also cost $1.3 billion. Annual dividends ... grew from $41 million to $302 million."
    },
    {
      "year": 2023,
      "page": 8,
      "tag": "hold",
      "claim": "2023 年没有买卖，并将 AmEx 与 Coke 作为长期持有的代表案例。",
      "excerpt": "we did not buy or sell a share of either AMEX or Coke ... Patience pays"
    }
  ]
}
